<?xml version="1.0" encoding="UTF-8"?>
<!ELEMENT ADDRESSBOOK (PERSON)*>
<!ELEMENT PERSON (LASTNAME, FIRSTNAME, COMPANY, EMAIL)>
<!ELEMENT LASTNAME (#PCDATA)>
<!ELEMENT FIRSTNAME (#PCDATA)>
<!ELEMENT COMPANY (#PCDATA)>
<!ELEMENT EMAIL (#PCDATA)>
